{
  "title": "Divisão - ÷4, ÷5",
  "level": "D",
  "subject": "math",
  "pages": [
    {
      "pageNumber": 1,
      "title": "Por 4",
      "description": "Quartos.",
      "exercises": [
        {
          "type": "division",
          "question": "8 ÷ 4 =",
          "correctAnswer": 2
        },
        {
          "type": "division",
          "question": "12 ÷ 4 =",
          "correctAnswer": 3
        },
        {
          "type": "division",
          "question": "20 ÷ 4 =",
          "correctAnswer": 5
        }
      ]
    },
    {
      "pageNumber": 2,
      "title": "Por 5",
      "description": "Quintos.",
      "exercises": [
        {
          "type": "division",
          "question": "10 ÷ 5 =",
          "correctAnswer": 2
        },
        {
          "type": "division",
          "question": "25 ÷ 5 =",
          "correctAnswer": 5
        },
        {
          "type": "division",
          "question": "35 ÷ 5 =",
          "correctAnswer": 7
        }
      ]
    }
  ],
  "target": 6
}
