{
  "title": "English - Basic Vocabulary",
  "level": "A",
  "subject": "english",
  "repeatAll": 2,
  "pages": [
    {
      "pageNumber": 1,
      "title": "Colors",
      "description": "Type the English word.",
      "exercises": [
        { "type": "english_vocab", "question": "Vermelho", "correctAnswer": "red" },
        { "type": "english_vocab", "question": "Azul", "correctAnswer": "blue" },
        { "type": "english_vocab", "question": "Verde", "correctAnswer": "green" }
      ]
    },
    {
      "pageNumber": 2,
      "title": "Animals",
      "description": "Type the English word.",
      "exercises": [
        { "type": "english_vocab", "question": "Gato", "correctAnswer": "cat" },
        { "type": "english_vocab", "question": "Cachorro", "correctAnswer": "dog" },
        { "type": "english_vocab", "question": "Pássaro", "correctAnswer": "bird" }
      ]
    }
  ]
}


