{
  "title": "Subtração Simples 0–10",
  "level": "2A",
  "example": "Subtraia números de 0 a 10. Ex.: 7 - 3 = 4",
  "subject": "math",
  "repeatAll": 5,
  "pages": [
    {
      "pageNumber": 1,
      "title": "Subtração até 10 – Página 1",
      "description": "Subtraia números de 0 a 10.",
      "exercises": [
        { "type": "subtraction", "question": "5 - 2 =", "correctAnswer": 3 },
        { "type": "subtraction", "question": "7 - 4 =", "correctAnswer": 3 },
        { "type": "subtraction", "question": "9 - 1 =", "correctAnswer": 8 },
        { "type": "subtraction", "question": "6 - 3 =", "correctAnswer": 3 },
        { "type": "subtraction", "question": "8 - 5 =", "correctAnswer": 3 },
        { "type": "subtraction", "question": "10 - 7 =", "correctAnswer": 3 },
        { "type": "subtraction", "question": "4 - 2 =", "correctAnswer": 2 },
        { "type": "subtraction", "question": "3 - 0 =", "correctAnswer": 3 },
        { "type": "subtraction", "question": "6 - 6 =", "correctAnswer": 0 },
        { "type": "subtraction", "question": "8 - 2 =", "correctAnswer": 6 }
      ]
    },
    {
      "pageNumber": 2,
      "title": "Subtração até 10 – Página 2",
      "description": "Subtraia números de 0 a 10.",
      "exercises": [
        { "type": "subtraction", "question": "7 - 3 =", "correctAnswer": 4 },
        { "type": "subtraction", "question": "9 - 6 =", "correctAnswer": 3 },
        { "type": "subtraction", "question": "10 - 4 =", "correctAnswer": 6 },
        { "type": "subtraction", "question": "5 - 1 =", "correctAnswer": 4 },
        { "type": "subtraction", "question": "6 - 2 =", "correctAnswer": 4 },
        { "type": "subtraction", "question": "8 - 3 =", "correctAnswer": 5 },
        { "type": "subtraction", "question": "4 - 1 =", "correctAnswer": 3 },
        { "type": "subtraction", "question": "2 - 2 =", "correctAnswer": 0 },
        { "type": "subtraction", "question": "9 - 0 =", "correctAnswer": 9 },
        { "type": "subtraction", "question": "10 - 8 =", "correctAnswer": 2 }
      ]
    }
  ],
  "target": 100
}


