{
  "title": "Subtração - Até 20 (reagrupamento)",
  "level": "B",
  "subject": "math",
  "pages": [
    {
      "pageNumber": 1,
      "title": "Até 20",
      "description": "Subtração com reagrupamento simples.",
      "exercises": [
        {
          "type": "subtraction",
          "question": "17 - 9 =",
          "correctAnswer": 8
        },
        {
          "type": "subtraction",
          "question": "18 - 7 =",
          "correctAnswer": 11
        },
        {
          "type": "subtraction",
          "question": "16 - 8 =",
          "correctAnswer": 8
        },
        {
          "type": "subtraction",
          "question": "19 - 6 =",
          "correctAnswer": 13
        },
        {
          "type": "subtraction",
          "question": "15 - 9 =",
          "correctAnswer": 6
        }
      ]
    }
  ],
  "target": 5
}
