{
  "title": "English - Basic Phrases",
  "level": "A",
  "subject": "english",
  "pages": [
    {
      "pageNumber": 1,
      "title": "Greetings",
      "description": "Type the English phrase.",
      "exercises": [
        { "type": "english_phrases", "question": "Bom dia", "correctAnswer": "good morning" },
        { "type": "english_phrases", "question": "Boa tarde", "correctAnswer": "good afternoon" },
        { "type": "english_phrases", "question": "Boa noite", "correctAnswer": "good evening" }
      ]
    }
  ]
}


