{
  "title": "Adição - Problemas Simples",
  "level": "A",
  "subject": "math",
  "pages": [
    {
      "pageNumber": 1,
      "title": "Aplicações",
      "description": "Resolva os problemas.",
      "exercises": [
        { "type": "addition", "question": "João tinha 3 balas e ganhou 5. Agora tem?", "correctAnswer": 8 },
        { "type": "addition", "question": "Maria tinha 7 figurinhas e ganhou 6. Agora tem?", "correctAnswer": 13 },
        { "type": "addition", "question": "2 caixas com 4 maçãs em cada. Total?", "correctAnswer": 8 }
      ]
    }
  ]
}


