{
  "title": "Subtração - Problemas",
  "level": "D",
  "subject": "math",
  "pages": [
    {
      "pageNumber": 1,
      "title": "Aplicações",
      "description": "Resolva os problemas.",
      "exercises": [
        { "type": "subtraction", "question": "Um ônibus tinha 45 pessoas. 17 desceram. Restam?", "correctAnswer": 28 },
        { "type": "subtraction", "question": "Havia 72 livros, 29 foram emprestados. Restam?", "correctAnswer": 43 },
        { "type": "subtraction", "question": "Uma corrida de 100m, já corri 64m. Faltam?", "correctAnswer": 36 }
      ]
    }
  ]
}


