{
  "title": "English - Basic Phrases 2",
  "level": "A",
  "subject": "english",
  "pages": [
    {
      "pageNumber": 1,
      "title": "Everyday",
      "description": "Type the English phrase.",
      "exercises": [
        {
          "type": "english_phrases",
          "question": "Como vai?",
          "correctAnswer": "how are you?"
        },
        {
          "type": "english_phrases",
          "question": "Obrigado(a)",
          "correctAnswer": "thank you"
        },
        {
          "type": "english_phrases",
          "question": "Por favor",
          "correctAnswer": "please"
        }
      ]
    }
  ],
  "target": 3
}
