{
  "title": "Multiplicação - Iniciação (x2, x3)",
  "level": "A",
  "subject": "math",
  "pages": [
    { "pageNumber": 1, "title": "Por 2", "description": "Dobros.", "exercises": [
      { "type": "multiplication", "question": "2 x 1 =", "correctAnswer": 2 },
      { "type": "multiplication", "question": "2 x 2 =", "correctAnswer": 4 },
      { "type": "multiplication", "question": "2 x 3 =", "correctAnswer": 6 },
      { "type": "multiplication", "question": "2 x 4 =", "correctAnswer": 8 },
      { "type": "multiplication", "question": "2 x 5 =", "correctAnswer": 10 }
    ]},
    { "pageNumber": 2, "title": "Por 3", "description": "Triplos.", "exercises": [
      { "type": "multiplication", "question": "3 x 1 =", "correctAnswer": 3 },
      { "type": "multiplication", "question": "3 x 2 =", "correctAnswer": 6 },
      { "type": "multiplication", "question": "3 x 3 =", "correctAnswer": 9 },
      { "type": "multiplication", "question": "3 x 4 =", "correctAnswer": 12 },
      { "type": "multiplication", "question": "3 x 5 =", "correctAnswer": 15 }
    ]}
  ]
}


