{
  "title": "Adição - Reagrupamento Simples",
  "level": "A",
  "subject": "math",
  "pages": [
    {
      "pageNumber": 1,
      "title": "Até 20",
      "description": "Some e reagruppe.",
      "exercises": [
        {
          "type": "addition",
          "question": "9 + 7 =",
          "correctAnswer": 16
        },
        {
          "type": "addition",
          "question": "8 + 9 =",
          "correctAnswer": 17
        },
        {
          "type": "addition",
          "question": "6 + 8 =",
          "correctAnswer": 14
        },
        {
          "type": "addition",
          "question": "7 + 7 =",
          "correctAnswer": 14
        },
        {
          "type": "addition",
          "question": "5 + 9 =",
          "correctAnswer": 14
        }
      ]
    }
  ],
  "target": 5
}
