{
  "title": "Subtração - Até 100",
  "level": "C",
  "subject": "math",
  "pages": [
    {
      "pageNumber": 1,
      "title": "Até 100",
      "description": "Prática com dezenas.",
      "exercises": [
        {
          "type": "subtraction",
          "question": "54 - 29 =",
          "correctAnswer": 25
        },
        {
          "type": "subtraction",
          "question": "63 - 17 =",
          "correctAnswer": 46
        },
        {
          "type": "subtraction",
          "question": "80 - 45 =",
          "correctAnswer": 35
        },
        {
          "type": "subtraction",
          "question": "92 - 38 =",
          "correctAnswer": 54
        },
        {
          "type": "subtraction",
          "question": "75 - 27 =",
          "correctAnswer": 48
        }
      ]
    }
  ],
  "target": 5
}
