{
  "title": "Problemas com Frações (Texto)",
  "level": "E",
  "example": "Traduza para frações, opere e simplifique.",
  "subject": "math",
  "pages": [
    {
      "pageNumber": 1,
      "title": "Situações do dia a dia",
      "description": "Responda como fração simplificada.",
      "exercises": [
        { "type": "fraction_add", "question": "Você comeu 1/4 da pizza e seu amigo 2/4. Quanto foi comido?", "correctAnswer": "3/4" },
        { "type": "fraction_sub", "question": "Um tanque tem 3/5 cheio. Usa-se 1/5. Quanto sobra?", "correctAnswer": "2/5" },
        { "type": "fraction_add", "question": "Beatriz leu 1/3 do livro de manhã e 1/6 à tarde. Quanto leu?", "correctAnswer": "1/2" },
        { "type": "fraction_sub", "question": "Um bolo de 1 inteiro; come-se 3/8. Quanto resta?", "correctAnswer": "5/8" },
        { "type": "fraction_add", "question": "João percorreu 2/5 da trilha e depois 1/10. Total?", "correctAnswer": "1/2" },
        { "type": "fraction_sub", "question": "Faltam 3/4 do filme. Assiste-se 1/8. Faltam?", "correctAnswer": "5/8" },
        { "type": "fraction_add", "question": "Uma garrafa tem 3/10 de suco e adicionam 1/5. Fica?", "correctAnswer": "1/2" },
        { "type": "fraction_sub", "question": "Havia 7/12 de torta. Come-se 1/6. Resta?", "correctAnswer": "5/12" },
        { "type": "fraction_add", "question": "Planta-se 1/8 do canteiro e depois 3/8. Total?", "correctAnswer": "1/2" },
        { "type": "fraction_sub", "question": "Uma barra de chocolate 1 inteiro; come-se 2/5. Resta?", "correctAnswer": "3/5" }
      ]
    }
  ],
  "target": 60
}


