{
  "title": "Multiplicação - Taboada (x6, x7)",
  "level": "B",
  "subject": "math",
  "pages": [
    {
      "pageNumber": 1,
      "title": "Por 6",
      "description": "Fatos do 6.",
      "exercises": [
        {
          "type": "multiplication",
          "question": "6 x 2 =",
          "correctAnswer": 12
        },
        {
          "type": "multiplication",
          "question": "6 x 3 =",
          "correctAnswer": 18
        },
        {
          "type": "multiplication",
          "question": "6 x 4 =",
          "correctAnswer": 24
        }
      ]
    },
    {
      "pageNumber": 2,
      "title": "Por 7",
      "description": "Fatos do 7.",
      "exercises": [
        {
          "type": "multiplication",
          "question": "7 x 2 =",
          "correctAnswer": 14
        },
        {
          "type": "multiplication",
          "question": "7 x 3 =",
          "correctAnswer": 21
        },
        {
          "type": "multiplication",
          "question": "7 x 4 =",
          "correctAnswer": 28
        }
      ]
    }
  ],
  "target": 6
}
