{
  "title": "Contar Objetos 1–5",
  "level": "7A",
  "example": "Conte os objetos e escreva o número.",
  "subject": "math",
  "repeatAll": 2,
  "pages": [
    {
      "pageNumber": 1,
      "title": "Contar até 3",
      "description": "Conte os símbolos.",
      "exercises": [
        {
          "type": "count",
          "question": "★ ★",
          "correctAnswer": 2
        },
        {
          "type": "count",
          "question": "● ● ●",
          "correctAnswer": 3
        },
        {
          "type": "count",
          "question": "▲",
          "correctAnswer": 1
        },
        {
          "type": "count",
          "question": "◆ ◆",
          "correctAnswer": 2
        },
        {
          "type": "count",
          "question": "♥ ♥ ♥",
          "correctAnswer": 3
        },
        {
          "type": "count",
          "question": "☀",
          "correctAnswer": 1
        },
        {
          "type": "count",
          "question": "♣ ♣",
          "correctAnswer": 2
        },
        {
          "type": "count",
          "question": "★ ★ ★",
          "correctAnswer": 3
        },
        {
          "type": "count",
          "question": "●",
          "correctAnswer": 1
        },
        {
          "type": "count",
          "question": "▲ ▲",
          "correctAnswer": 2
        }
      ]
    },
    {
      "pageNumber": 2,
      "title": "Contar até 5",
      "description": "Conte os símbolos.",
      "exercises": [
        {
          "type": "count",
          "question": "★ ★ ★ ★",
          "correctAnswer": 4
        },
        {
          "type": "count",
          "question": "● ● ● ● ●",
          "correctAnswer": 5
        },
        {
          "type": "count",
          "question": "▲ ▲ ▲",
          "correctAnswer": 3
        },
        {
          "type": "count",
          "question": "◆",
          "correctAnswer": 1
        },
        {
          "type": "count",
          "question": "♥ ♥",
          "correctAnswer": 2
        },
        {
          "type": "count",
          "question": "☀ ☀ ☀ ☀ ☀",
          "correctAnswer": 5
        },
        {
          "type": "count",
          "question": "♣ ♣ ♣ ♣",
          "correctAnswer": 4
        },
        {
          "type": "count",
          "question": "★ ★ ★",
          "correctAnswer": 3
        },
        {
          "type": "count",
          "question": "● ●",
          "correctAnswer": 2
        },
        {
          "type": "count",
          "question": "▲ ▲ ▲ ▲ ▲",
          "correctAnswer": 5
        }
      ]
    }
  ],
  "target": 40
}
