{
  "title": "Adição - Dobros",
  "level": "A",
  "subject": "math",
  "pages": [
    {
      "pageNumber": 1,
      "title": "Dobros até 20",
      "description": "Some o mesmo número.",
      "exercises": [
        { "type": "addition", "question": "1 + 1 =", "correctAnswer": 2 },
        { "type": "addition", "question": "2 + 2 =", "correctAnswer": 4 },
        { "type": "addition", "question": "3 + 3 =", "correctAnswer": 6 },
        { "type": "addition", "question": "4 + 4 =", "correctAnswer": 8 },
        { "type": "addition", "question": "5 + 5 =", "correctAnswer": 10 },
        { "type": "addition", "question": "6 + 6 =", "correctAnswer": 12 },
        { "type": "addition", "question": "7 + 7 =", "correctAnswer": 14 },
        { "type": "addition", "question": "8 + 8 =", "correctAnswer": 16 },
        { "type": "addition", "question": "9 + 9 =", "correctAnswer": 18 },
        { "type": "addition", "question": "10 + 10 =", "correctAnswer": 20 }
      ]
    }
  ]
}


