{
  "title": "English - Basic Vocabulary 2",
  "level": "A",
  "subject": "english",
  "pages": [
    {
      "pageNumber": 1,
      "title": "Food",
      "description": "Type the English word.",
      "exercises": [
        {
          "type": "english_vocab",
          "question": "Maçã",
          "correctAnswer": "apple"
        },
        {
          "type": "english_vocab",
          "question": "Pão",
          "correctAnswer": "bread"
        },
        {
          "type": "english_vocab",
          "question": "Água",
          "correctAnswer": "water"
        }
      ]
    }
  ],
  "target": 3
}
