{
  "title": "Frações: Denominadores Diferentes I",
  "level": "E",
  "example": "Para denominadores diferentes: faça denominadores comuns (m.m.c) e opere. Ex.: 1/2 + 1/3 = 5/6",
  "subject": "math",
  "pages": [
    {
      "pageNumber": 1,
      "title": "Soma (denominadores diferentes)",
      "description": "Encontre denominador comum e simplifique.",
      "exercises": [
        { "type": "fraction_add", "question": "1/2 + 1/3 =", "correctAnswer": "5/6" },
        { "type": "fraction_add", "question": "1/4 + 1/6 =", "correctAnswer": "5/12" },
        { "type": "fraction_add", "question": "2/3 + 1/6 =", "correctAnswer": "5/6" },
        { "type": "fraction_add", "question": "3/4 + 1/8 =", "correctAnswer": "7/8" },
        { "type": "fraction_add", "question": "2/5 + 1/10 =", "correctAnswer": "1/2" },
        { "type": "fraction_add", "question": "3/10 + 1/2 =", "correctAnswer": "4/5" },
        { "type": "fraction_add", "question": "1/3 + 1/9 =", "correctAnswer": "4/9" },
        { "type": "fraction_add", "question": "2/7 + 3/14 =", "correctAnswer": "1/2" },
        { "type": "fraction_add", "question": "5/6 + 1/3 =", "correctAnswer": "7/6" },
        { "type": "fraction_add", "question": "3/5 + 1/2 =", "correctAnswer": "11/10" }
      ]
    },
    {
      "pageNumber": 2,
      "title": "Subtração (denominadores diferentes)",
      "description": "Encontre denominador comum e simplifique.",
      "exercises": [
        { "type": "fraction_sub", "question": "3/4 - 1/6 =", "correctAnswer": "7/12" },
        { "type": "fraction_sub", "question": "5/6 - 1/2 =", "correctAnswer": "1/3" },
        { "type": "fraction_sub", "question": "7/8 - 1/4 =", "correctAnswer": "5/8" },
        { "type": "fraction_sub", "question": "2/3 - 1/9 =", "correctAnswer": "5/9" },
        { "type": "fraction_sub", "question": "3/5 - 1/10 =", "correctAnswer": "1/2" },
        { "type": "fraction_sub", "question": "5/12 - 1/3 =", "correctAnswer": "1/12" },
        { "type": "fraction_sub", "question": "7/10 - 1/2 =", "correctAnswer": "1/5" },
        { "type": "fraction_sub", "question": "5/8 - 1/16 =", "correctAnswer": "9/16" },
        { "type": "fraction_sub", "question": "11/12 - 1/3 =", "correctAnswer": "7/12" },
        { "type": "fraction_sub", "question": "9/10 - 1/5 =", "correctAnswer": "7/10" }
      ]
    },
    {
      "pageNumber": 3,
      "title": "Mistura I",
      "description": "Adição e subtração.",
      "exercises": [
        { "type": "fraction_add", "question": "1/2 + 1/5 =", "correctAnswer": "7/10" },
        { "type": "fraction_sub", "question": "3/4 - 1/8 =", "correctAnswer": "5/8" },
        { "type": "fraction_add", "question": "2/3 + 1/9 =", "correctAnswer": "7/9" },
        { "type": "fraction_sub", "question": "5/6 - 1/3 =", "correctAnswer": "1/2" },
        { "type": "fraction_add", "question": "3/5 + 1/2 =", "correctAnswer": "11/10" },
        { "type": "fraction_sub", "question": "7/10 - 3/5 =", "correctAnswer": "1/10" },
        { "type": "fraction_add", "question": "1/3 + 5/6 =", "correctAnswer": "7/6" },
        { "type": "fraction_sub", "question": "7/8 - 3/4 =", "correctAnswer": "1/8" },
        { "type": "fraction_add", "question": "4/9 + 1/3 =", "correctAnswer": "7/9" },
        { "type": "fraction_sub", "question": "5/12 - 1/4 =", "correctAnswer": "1/6" }
      ]
    }
  ],
  "target": 120
}


