{
  "title": "Transformação de Fração em Número Misto",
  "level": "D",
  "example": "Divida o numerador pelo denominador: quociente é a parte inteira, resto vira numerador do misto. Ex.: 7/3 = 2 1/3",
  "subject": "math",
  "repeatAll": 2,
  "pages": [
    {
      "pageNumber": 1,
      "title": "Improprias para Mistos",
      "description": "Converta frações impróprias em números mistos.",
      "exercises": [
        {
          "type": "fraction_mixed",
          "question": "Converta 7/3 em número misto:",
          "correctAnswer": "2 1/3"
        },
        {
          "type": "fraction_mixed",
          "question": "Converta 11/4 em número misto:",
          "correctAnswer": "2 3/4"
        },
        {
          "type": "fraction_mixed",
          "question": "Converta 9/2 em número misto:",
          "correctAnswer": "4 1/2"
        },
        {
          "type": "fraction_mixed",
          "question": "Converta 13/5 em número misto:",
          "correctAnswer": "2 3/5"
        },
        {
          "type": "fraction_mixed",
          "question": "Converta 10/3 em número misto:",
          "correctAnswer": "3 1/3"
        },
        {
          "type": "fraction_mixed",
          "question": "Converta 12/5 em número misto:",
          "correctAnswer": "2 2/5"
        },
        {
          "type": "fraction_mixed",
          "question": "Converta 17/6 em número misto:",
          "correctAnswer": "2 5/6"
        },
        {
          "type": "fraction_mixed",
          "question": "Converta 19/4 em número misto:",
          "correctAnswer": "4 3/4"
        },
        {
          "type": "fraction_mixed",
          "question": "Converta 16/7 em número misto:",
          "correctAnswer": "2 2/7"
        },
        {
          "type": "fraction_mixed",
          "question": "Converta 21/8 em número misto:",
          "correctAnswer": "2 5/8"
        }
      ]
    },
    {
      "pageNumber": 2,
      "title": "Simplifique e Converta",
      "description": "Simplifique quando necessário e converta em número misto.",
      "exercises": [
        {
          "type": "fraction_mixed",
          "question": "Converta 14/6 em número misto:",
          "correctAnswer": "2 1/3"
        },
        {
          "type": "fraction_mixed",
          "question": "Converta 22/5 em número misto:",
          "correctAnswer": "4 2/5"
        },
        {
          "type": "fraction_mixed",
          "question": "Converta 15/4 em número misto:",
          "correctAnswer": "3 3/4"
        },
        {
          "type": "fraction_mixed",
          "question": "Converta 25/6 em número misto:",
          "correctAnswer": "4 1/6"
        },
        {
          "type": "fraction_mixed",
          "question": "Converta 18/5 em número misto:",
          "correctAnswer": "3 3/5"
        },
        {
          "type": "fraction_mixed",
          "question": "Converta 27/8 em número misto:",
          "correctAnswer": "3 3/8"
        },
        {
          "type": "fraction_mixed",
          "question": "Converta 20/3 em número misto:",
          "correctAnswer": "6 2/3"
        },
        {
          "type": "fraction_mixed",
          "question": "Converta 23/6 em número misto:",
          "correctAnswer": "3 5/6"
        },
        {
          "type": "fraction_mixed",
          "question": "Converta 29/7 em número misto:",
          "correctAnswer": "4 1/7"
        },
        {
          "type": "fraction_mixed",
          "question": "Converta 33/10 em número misto:",
          "correctAnswer": "3 3/10"
        }
      ]
    },
    {
      "pageNumber": 3,
      "title": "Improprias para Mistos - Prática 2",
      "description": "Mais conversões.",
      "exercises": [
        {
          "type": "fraction_mixed",
          "question": "Converta 23/7 em número misto:",
          "correctAnswer": "3 2/7"
        },
        {
          "type": "fraction_mixed",
          "question": "Converta 25/9 em número misto:",
          "correctAnswer": "2 7/9"
        },
        {
          "type": "fraction_mixed",
          "question": "Converta 31/5 em número misto:",
          "correctAnswer": "6 1/5"
        },
        {
          "type": "fraction_mixed",
          "question": "Converta 41/6 em número misto:",
          "correctAnswer": "6 5/6"
        },
        {
          "type": "fraction_mixed",
          "question": "Converta 29/4 em número misto:",
          "correctAnswer": "7 1/4"
        },
        {
          "type": "fraction_mixed",
          "question": "Converta 34/7 em número misto:",
          "correctAnswer": "4 6/7"
        },
        {
          "type": "fraction_mixed",
          "question": "Converta 27/5 em número misto:",
          "correctAnswer": "5 2/5"
        },
        {
          "type": "fraction_mixed",
          "question": "Converta 38/9 em número misto:",
          "correctAnswer": "4 2/9"
        },
        {
          "type": "fraction_mixed",
          "question": "Converta 45/8 em número misto:",
          "correctAnswer": "5 5/8"
        },
        {
          "type": "fraction_mixed",
          "question": "Converta 50/7 em número misto:",
          "correctAnswer": "7 1/7"
        }
      ]
    },
    {
      "pageNumber": 4,
      "title": "Simplifique e Converta - Prática 2",
      "description": "Mais simplificações e conversões.",
      "exercises": [
        {
          "type": "fraction_mixed",
          "question": "Converta 35/6 em número misto:",
          "correctAnswer": "5 5/6"
        },
        {
          "type": "fraction_mixed",
          "question": "Converta 44/7 em número misto:",
          "correctAnswer": "6 2/7"
        },
        {
          "type": "fraction_mixed",
          "question": "Converta 39/5 em número misto:",
          "correctAnswer": "7 4/5"
        },
        {
          "type": "fraction_mixed",
          "question": "Converta 52/9 em número misto:",
          "correctAnswer": "5 7/9"
        },
        {
          "type": "fraction_mixed",
          "question": "Converta 47/6 em número misto:",
          "correctAnswer": "7 5/6"
        },
        {
          "type": "fraction_mixed",
          "question": "Converta 58/11 em número misto:",
          "correctAnswer": "5 3/11"
        },
        {
          "type": "fraction_mixed",
          "question": "Converta 63/8 em número misto:",
          "correctAnswer": "7 7/8"
        },
        {
          "type": "fraction_mixed",
          "question": "Converta 71/12 em número misto:",
          "correctAnswer": "5 11/12"
        },
        {
          "type": "fraction_mixed",
          "question": "Converta 80/13 em número misto:",
          "correctAnswer": "6 2/13"
        },
        {
          "type": "fraction_mixed",
          "question": "Converta 95/14 em número misto:",
          "correctAnswer": "6 11/14"
        }
      ]
    },
    {
      "pageNumber": 5,
      "title": "Revisão de Mistos",
      "description": "Diversos níveis de conversão.",
      "exercises": [
        {
          "type": "fraction_mixed",
          "question": "Converta 13/2 em número misto:",
          "correctAnswer": "6 1/2"
        },
        {
          "type": "fraction_mixed",
          "question": "Converta 22/3 em número misto:",
          "correctAnswer": "7 1/3"
        },
        {
          "type": "fraction_mixed",
          "question": "Converta 17/4 em número misto:",
          "correctAnswer": "4 1/4"
        },
        {
          "type": "fraction_mixed",
          "question": "Converta 19/5 em número misto:",
          "correctAnswer": "3 4/5"
        },
        {
          "type": "fraction_mixed",
          "question": "Converta 26/7 em número misto:",
          "correctAnswer": "3 5/7"
        },
        {
          "type": "fraction_mixed",
          "question": "Converta 31/9 em número misto:",
          "correctAnswer": "3 4/9"
        },
        {
          "type": "fraction_mixed",
          "question": "Converta 28/6 em número misto:",
          "correctAnswer": "4 2/3"
        },
        {
          "type": "fraction_mixed",
          "question": "Converta 33/10 em número misto:",
          "correctAnswer": "3 3/10"
        },
        {
          "type": "fraction_mixed",
          "question": "Converta 41/12 em número misto:",
          "correctAnswer": "3 5/12"
        },
        {
          "type": "fraction_mixed",
          "question": "Converta 59/15 em número misto:",
          "correctAnswer": "3 14/15"
        }
      ]
    }
  ],
  "target": 100
}
