{
  "title": "Divisão - ÷8, ÷9, ÷10",
  "level": "D",
  "subject": "math",
  "pages": [
    {
      "pageNumber": 1,
      "title": "Por 8",
      "description": "Oitavos.",
      "exercises": [
        {
          "type": "division",
          "question": "16 ÷ 8 =",
          "correctAnswer": 2
        },
        {
          "type": "division",
          "question": "24 ÷ 8 =",
          "correctAnswer": 3
        },
        {
          "type": "division",
          "question": "32 ÷ 8 =",
          "correctAnswer": 4
        }
      ]
    },
    {
      "pageNumber": 2,
      "title": "Por 9 e 10",
      "description": "Nonos e décimos.",
      "exercises": [
        {
          "type": "division",
          "question": "18 ÷ 9 =",
          "correctAnswer": 2
        },
        {
          "type": "division",
          "question": "27 ÷ 9 =",
          "correctAnswer": 3
        },
        {
          "type": "division",
          "question": "30 ÷ 10 =",
          "correctAnswer": 3
        }
      ]
    }
  ],
  "target": 6
}
