{
  "title": "Adição e Subtração 0–10",
  "level": "1A",
  "example": "Resolva operações até 10. Ex.: 7 − 3 = 4; 4 + 5 = 9",
  "subject": "math",
  "repeatAll": 5,
  "pages": [
    {
      "pageNumber": 1,
      "title": "Somas e Subtrações – Página 1",
      "description": "Operações com números de 0 a 10.",
      "exercises": [
        { "type": "addition", "question": "1 + 4 =", "correctAnswer": 5 },
        { "type": "subtraction", "question": "7 - 3 =", "correctAnswer": 4 },
        { "type": "addition", "question": "2 + 6 =", "correctAnswer": 8 },
        { "type": "subtraction", "question": "9 - 5 =", "correctAnswer": 4 },
        { "type": "addition", "question": "0 + 7 =", "correctAnswer": 7 },
        { "type": "subtraction", "question": "6 - 2 =", "correctAnswer": 4 },
        { "type": "addition", "question": "3 + 5 =", "correctAnswer": 8 },
        { "type": "subtraction", "question": "8 - 1 =", "correctAnswer": 7 },
        { "type": "addition", "question": "4 + 4 =", "correctAnswer": 8 },
        { "type": "subtraction", "question": "5 - 0 =", "correctAnswer": 5 }
      ]
    },
    {
      "pageNumber": 2,
      "title": "Somas e Subtrações – Página 2",
      "description": "Operações com números de 0 a 10.",
      "exercises": [
        { "type": "subtraction", "question": "10 - 2 =", "correctAnswer": 8 },
        { "type": "addition", "question": "1 + 3 =", "correctAnswer": 4 },
        { "type": "subtraction", "question": "6 - 4 =", "correctAnswer": 2 },
        { "type": "addition", "question": "2 + 7 =", "correctAnswer": 9 },
        { "type": "addition", "question": "5 + 3 =", "correctAnswer": 8 },
        { "type": "subtraction", "question": "9 - 8 =", "correctAnswer": 1 },
        { "type": "addition", "question": "0 + 9 =", "correctAnswer": 9 },
        { "type": "subtraction", "question": "7 - 6 =", "correctAnswer": 1 },
        { "type": "addition", "question": "4 + 2 =", "correctAnswer": 6 },
        { "type": "subtraction", "question": "8 - 3 =", "correctAnswer": 5 }
      ]
    }
  ],
  "target": 100
}


