{
  "title": "Frações: Soma e Subtração (Mesmos Denominadores)",
  "level": "E",
  "example": "Para mesmo denominador: some/subtraia numeradores e simplifique. Ex.: 3/8 + 1/8 = 1/2",
  "subject": "math",
  "pages": [
    {
      "pageNumber": 1,
      "title": "Somando frações (mesmo denominador)",
      "description": "Some e simplifique quando possível.",
      "exercises": [
        { "type": "fraction_add", "question": "1/4 + 2/4 =", "correctAnswer": "3/4" },
        { "type": "fraction_add", "question": "3/5 + 1/5 =", "correctAnswer": "4/5" },
        { "type": "fraction_add", "question": "2/3 + 1/3 =", "correctAnswer": "1" },
        { "type": "fraction_add", "question": "1/8 + 3/8 =", "correctAnswer": "1/2" },
        { "type": "fraction_add", "question": "5/10 + 2/10 =", "correctAnswer": "7/10" },
        { "type": "fraction_add", "question": "1/2 + 1/2 =", "correctAnswer": "1" },
        { "type": "fraction_add", "question": "2/6 + 1/6 =", "correctAnswer": "1/2" },
        { "type": "fraction_add", "question": "3/9 + 2/9 =", "correctAnswer": "5/9" },
        { "type": "fraction_add", "question": "4/7 + 1/7 =", "correctAnswer": "5/7" },
        { "type": "fraction_add", "question": "2/5 + 2/5 =", "correctAnswer": "4/5" }
      ]
    },
    {
      "pageNumber": 2,
      "title": "Subtraindo frações (mesmo denominador)",
      "description": "Subtraia e simplifique quando possível.",
      "exercises": [
        { "type": "fraction_sub", "question": "3/4 - 1/4 =", "correctAnswer": "1/2" },
        { "type": "fraction_sub", "question": "5/6 - 1/6 =", "correctAnswer": "2/3" },
        { "type": "fraction_sub", "question": "7/8 - 3/8 =", "correctAnswer": "1/2" },
        { "type": "fraction_sub", "question": "6/9 - 2/9 =", "correctAnswer": "4/9" },
        { "type": "fraction_sub", "question": "9/10 - 3/10 =", "correctAnswer": "3/5" },
        { "type": "fraction_sub", "question": "1 - 1/4 =", "correctAnswer": "3/4" },
        { "type": "fraction_sub", "question": "5/8 - 1/8 =", "correctAnswer": "1/2" },
        { "type": "fraction_sub", "question": "4/5 - 2/5 =", "correctAnswer": "2/5" },
        { "type": "fraction_sub", "question": "7/9 - 4/9 =", "correctAnswer": "1/3" },
        { "type": "fraction_sub", "question": "3/7 - 1/7 =", "correctAnswer": "2/7" }
      ]
    },
    {
      "pageNumber": 3,
      "title": "Mistura com denominadores maiores (11–20)",
      "description": "Some/subtraia e simplifique.",
      "exercises": [
        { "type": "fraction_add", "question": "3/11 + 4/11 =", "correctAnswer": "7/11" },
        { "type": "fraction_add", "question": "5/12 + 4/12 =", "correctAnswer": "3/2" },
        { "type": "fraction_sub", "question": "12/13 - 4/13 =", "correctAnswer": "8/13" },
        { "type": "fraction_add", "question": "7/14 + 1/14 =", "correctAnswer": "4/7" },
        { "type": "fraction_sub", "question": "14/15 - 3/15 =", "correctAnswer": "11/15" },
        { "type": "fraction_add", "question": "9/16 + 1/16 =", "correctAnswer": "5/8" },
        { "type": "fraction_sub", "question": "15/16 - 7/16 =", "correctAnswer": "1/2" },
        { "type": "fraction_add", "question": "10/17 + 5/17 =", "correctAnswer": "15/17" },
        { "type": "fraction_add", "question": "12/19 + 3/19 =", "correctAnswer": "15/19" },
        { "type": "fraction_sub", "question": "19/20 - 9/20 =", "correctAnswer": "1/2" }
      ]
    },
    {
      "pageNumber": 4,
      "title": "Unitárias (com 1)",
      "description": "Use 1 como inteiro.",
      "exercises": [
        { "type": "fraction_add", "question": "1/2 + 1/2 =", "correctAnswer": "1" },
        { "type": "fraction_add", "question": "1/3 + 1/3 =", "correctAnswer": "2/3" },
        { "type": "fraction_add", "question": "1/4 + 1/4 =", "correctAnswer": "1/2" },
        { "type": "fraction_sub", "question": "1 - 1/5 =", "correctAnswer": "4/5" },
        { "type": "fraction_sub", "question": "1 - 1/6 =", "correctAnswer": "5/6" },
        { "type": "fraction_sub", "question": "1 - 1/7 =", "correctAnswer": "6/7" },
        { "type": "fraction_sub", "question": "1 - 1/8 =", "correctAnswer": "7/8" },
        { "type": "fraction_sub", "question": "1 - 1/9 =", "correctAnswer": "8/9" },
        { "type": "fraction_sub", "question": "1 - 1/10 =", "correctAnswer": "9/10" },
        { "type": "fraction_sub", "question": "1 - 1/12 =", "correctAnswer": "11/12" }
      ]
    },
    {
      "pageNumber": 5,
      "title": "Revisão (mesmo denominador)",
      "description": "Misto de operações.",
      "exercises": [
        { "type": "fraction_add", "question": "2/3 + 1/3 =", "correctAnswer": "1" },
        { "type": "fraction_sub", "question": "5/8 - 3/8 =", "correctAnswer": "1/4" },
        { "type": "fraction_add", "question": "3/10 + 6/10 =", "correctAnswer": "9/10" },
        { "type": "fraction_sub", "question": "7/9 - 1/9 =", "correctAnswer": "2/3" },
        { "type": "fraction_add", "question": "4/7 + 2/7 =", "correctAnswer": "6/7" },
        { "type": "fraction_sub", "question": "9/12 - 3/12 =", "correctAnswer": "1/2" },
        { "type": "fraction_add", "question": "5/6 + 1/6 =", "correctAnswer": "1" },
        { "type": "fraction_sub", "question": "8/15 - 2/15 =", "correctAnswer": "2/3" },
        { "type": "fraction_add", "question": "7/8 + 1/8 =", "correctAnswer": "1" },
        { "type": "fraction_sub", "question": "11/12 - 5/12 =", "correctAnswer": "1/2" }
      ]
    }
  ],
  "target": 120
}


