{
  "title": "Compreensão de Texto - Curto 2",
  "level": "A",
  "subject": "portuguese",
  "pages": [
    {
      "pageNumber": 1,
      "title": "Texto 2",
      "description": "Responda às perguntas.",
      "exercises": [
        { "type": "reading", "question": "O protagonista é? (menino/menina/cachorro)", "correctAnswer": "menina" },
        { "type": "reading", "question": "O local foi? (parque/cinema/escola)", "correctAnswer": "parque" },
        { "type": "reading", "question": "Ela levou? (lanche/bola/livro)", "correctAnswer": "lanche" }
      ]
    }
  ]
}


