{
  "title": "Divisão - Iniciação (÷2, ÷3)",
  "level": "A",
  "subject": "math",
  "pages": [
    {
      "pageNumber": 1,
      "title": "Por 2",
      "description": "Metades.",
      "exercises": [
        {
          "type": "division",
          "question": "4 ÷ 2 =",
          "correctAnswer": 2
        },
        {
          "type": "division",
          "question": "6 ÷ 2 =",
          "correctAnswer": 3
        },
        {
          "type": "division",
          "question": "8 ÷ 2 =",
          "correctAnswer": 4
        }
      ]
    },
    {
      "pageNumber": 2,
      "title": "Por 3",
      "description": "Terços.",
      "exercises": [
        {
          "type": "division",
          "question": "6 ÷ 3 =",
          "correctAnswer": 2
        },
        {
          "type": "division",
          "question": "9 ÷ 3 =",
          "correctAnswer": 3
        },
        {
          "type": "division",
          "question": "12 ÷ 3 =",
          "correctAnswer": 4
        }
      ]
    }
  ],
  "target": 6
}
